id,conversation_id,created_at,date,time,timezone,user_id,username,name,place,tweet,mentions,urls,photos,replies_count,retweets_count,likes_count,hashtags,cashtags,link,retweet,quote_url,video,near,geo,source,user_rt_id,user_rt,retweet_id,reply_to,retweet_date
1189505340942868485,1189046764378185728,1572435147000,2019-10-30,17:02:27,India Standard Time,24705126,shashitharoor,Shashi Tharoor,,"5. The National Critical Information Infrastructure Protection Centre is under the ‘administrative control’ of the NTRO. Under this government, why has India’s premier technical intelligence agency not been offered the resources to fight back against such attacks?",['pmoindia'],[],[],4,30,108,[],[],https://twitter.com/ShashiTharoor/status/1189505340942868485,False,,0,,,,,,,"[{'user_id': '24705126', 'username': 'ShashiTharoor'}, {'user_id': '471741741', 'username': 'PMOIndia'}]",
1189505102962257920,1189046764378185728,1572435091000,2019-10-30,17:01:31,India Standard Time,24705126,shashitharoor,Shashi Tharoor,,"4. At the Combined Commanders Conference in 2014, @PMOIndia called for the creation of a Digital Armed Force. Five years later, there is no sign of it. Is this yet another jumla? On natonal security, can we afford hollow promises?  https://www.pmindia.gov.in/en/news_updates/pms-address-at-the-combined-commanders-conference/ …",['pmoindia'],['https://www.pmindia.gov.in/en/news_updates/pms-address-at-the-combined-commanders-conference/'],[],7,32,117,[],[],https://twitter.com/ShashiTharoor/status/1189505102962257920,False,,0,,,,,,,"[{'user_id': '24705126', 'username': 'ShashiTharoor'}, {'user_id': '471741741', 'username': 'PMOIndia'}]",
1189504682445557762,1189046764378185728,1572434990000,2019-10-30,16:59:50,India Standard Time,24705126,shashitharoor,Shashi Tharoor,,"3. For years now, a ‘Defence Cyber Agency’ has been in the works - why has it taken so long for the government to create and fortify India’s cyber capabilities in order to punish, deter and repel such attacks? https://www.indiatoday.in/india/story/india-defence-cyber-agency-may-rear-admiral-mohit-1513381-2019-04-30 …",[],['https://www.indiatoday.in/india/story/india-defence-cyber-agency-may-rear-admiral-mohit-1513381-2019-04-30'],[],1,28,92,[],[],https://twitter.com/ShashiTharoor/status/1189504682445557762,False,,0,,,,,,,"[{'user_id': '24705126', 'username': 'ShashiTharoor'}]",
1189504538924814339,1189046764378185728,1572434956000,2019-10-30,16:59:16,India Standard Time,24705126,shashitharoor,Shashi Tharoor,,"2. Despite widespread acceptance of the 2015 UN Group of Governmental Experts’ report on cyber norms, there has been no movement internationally to create binding instruments that punish such acts. Why has the Indian government not taken an initiative on this front?",[],[],[],4,23,60,[],[],https://twitter.com/ShashiTharoor/status/1189504538924814339,False,,0,,,,,,,"[{'user_id': '24705126', 'username': 'ShashiTharoor'}]",
1189504410944061440,1189046764378185728,1572434926000,2019-10-30,16:58:46,India Standard Time,24705126,shashitharoor,Shashi Tharoor,,"1. With NPCIL confirming the cyber attack on Kudankulam, the National Cyber Security Coordinator (NCSC) and NSA must address public concerns about this dangerous intrusion on India’s critical infrastructure https://www.thequint.com/news/india/kudankulam-nuclear-power-plant-malware-attack-correct-confirms-npcil …",[],['https://www.thequint.com/news/india/kudankulam-nuclear-power-plant-malware-attack-correct-confirms-npcil'],[],4,35,130,[],[],https://twitter.com/ShashiTharoor/status/1189504410944061440,False,,0,,,,,,,"[{'user_id': '24705126', 'username': 'ShashiTharoor'}]",
1189504325732597760,1189046764378185728,1572434905000,2019-10-30,16:58:25,India Standard Time,24705126,shashitharoor,Shashi Tharoor,,A further thread on this serious issue:,[],[],[],1,10,46,[],[],https://twitter.com/ShashiTharoor/status/1189504325732597760,False,,0,,,,,,,"[{'user_id': '24705126', 'username': 'ShashiTharoor'}]",
1189498745211080704,1189498745211080704,1572433575000,2019-10-30,16:36:15,India Standard Time,24705126,shashitharoor,Shashi Tharoor,,"On #SardarPatel's 134th birthday, a look at the attempts by the BJP & Narendra Modi to appropriate his illustrious legacy: https://www.thequint.com/voices/opinion/shashi-tharoor-on-sardar-patel-national-unity-day-modi-nationalism-gandhian-values …",[],['https://www.thequint.com/voices/opinion/shashi-tharoor-on-sardar-patel-national-unity-day-modi-nationalism-gandhian-values'],[],173,118,698,['#sardarpatel'],[],https://twitter.com/ShashiTharoor/status/1189498745211080704,False,,0,,,,,,,"[{'user_id': '24705126', 'username': 'ShashiTharoor'}]",
1189483245538177024,1189483245538177024,1572429879000,2019-10-30,15:34:39,India Standard Time,24705126,shashitharoor,Shashi Tharoor,,Back in Delhi in the wee hours today to chair an important meeting of the Parliamentary StandingCommittee on InformationTechnology. Met w/ Government &film industry representatives (incl producers & distributors) to review provisions of the proposed Cinematograph Amendment Bill.,[],[],[],15,65,592,[],[],https://twitter.com/ShashiTharoor/status/1189483245538177024,False,,0,,,,,,,"[{'user_id': '24705126', 'username': 'ShashiTharoor'}]",
1189482440420552704,1189482440420552704,1572429687000,2019-10-30,15:31:27,India Standard Time,24705126,shashitharoor,Shashi Tharoor,,Met with @IncIndia-leaning Malayali expatriates in Kuwait yesterday to discuss issues ranging from flight connections back home to developments in Indian politics. Always good to connect with our diaspora wherever I go! pic.twitter.com/1YIwBEVd2z,['incindia'],[],"['https://pbs.twimg.com/media/EIHj9RrU4AEg-qk.jpg', 'https://pbs.twimg.com/media/EIHj9RvUYAA-cvx.jpg']",6,54,646,[],[],https://twitter.com/ShashiTharoor/status/1189482440420552704,False,,0,,,,,,,"[{'user_id': '24705126', 'username': 'ShashiTharoor'}, {'user_id': '1153045459', 'username': 'INCIndia'}]",
1189471391453569024,1189471391453569024,1572427053000,2019-10-30,14:47:33,India Standard Time,24705126,shashitharoor,Shashi Tharoor,,"Enjoyed an astonishing visit to a hospital that looks &feels like a five-star hotel, the RoyaleHayat in Kuwait. Conceived by Indian entrepreneurs, the Handa brothers, & helmed by a distinguished Kuwaiti, the hospital has become #1 in Maternal&Child Care, adding “ity”to”hospital”! pic.twitter.com/vdJuwQL5kM",[],[],"['https://pbs.twimg.com/media/EIHZSGcWwAEX81a.jpg', 'https://pbs.twimg.com/media/EIHZSGbWoAAjoFs.jpg', 'https://pbs.twimg.com/media/EIHZSGbX4AAZRCN.jpg', 'https://pbs.twimg.com/media/EIHZSGcWkAMLIBT.jpg']",30,107,1186,[],[],https://twitter.com/ShashiTharoor/status/1189471391453569024,False,,0,,,,,,,"[{'user_id': '24705126', 'username': 'ShashiTharoor'}]",
1189287122123051008,1189287122123051008,1572383120000,2019-10-30,02:35:20,India Standard Time,24705126,shashitharoor,Shashi Tharoor,,Good systematic reporting of the flaws in the police investigation of the Walayar murders: https://www.thenewsminute.com/article/reading-judgment-how-justice-walayar-sisters-was-let-down-shoddy-probe-111335 …,[],['https://www.thenewsminute.com/article/reading-judgment-how-justice-walayar-sisters-was-let-down-shoddy-probe-111335'],[],15,44,303,[],[],https://twitter.com/ShashiTharoor/status/1189287122123051008,False,,0,,,,,,,"[{'user_id': '24705126', 'username': 'ShashiTharoor'}]",
1189277865688403972,1189032572635865088,1572380913000,2019-10-30,01:58:33,India Standard Time,24705126,shashitharoor,Shashi Tharoor,,. Will check and urge speedy completion with measures to ensure minimum difficulty for the kids.,['kirankp85'],[],[],1,1,2,[],[],https://twitter.com/ShashiTharoor/status/1189277865688403972,False,,0,,,,,,,"[{'user_id': '24705126', 'username': 'ShashiTharoor'}, {'user_id': '152158104', 'username': 'KIRANKP85'}]",
1189209748916310017,1189209748916310017,1572364673000,2019-10-29,21:27:53,India Standard Time,24705126,shashitharoor,Shashi Tharoor,,"Enjoyed an excellent interactive session this morning w/students from several Indian schools in Kuwait. They asked amazingly good, sharp questions! Launched 16 year old Khushi Dhillon’s first book “Forbes in the Making”. pic.twitter.com/WCwJB5PbPU",[],[],"['https://pbs.twimg.com/media/EIDr8rkWwAE84KQ.jpg', 'https://pbs.twimg.com/media/EIDr8rvXYAA_s4S.jpg', 'https://pbs.twimg.com/media/EIDr8rsWsAAOe-4.jpg']",11,57,583,[],[],https://twitter.com/ShashiTharoor/status/1189209748916310017,False,,0,,,,,,,"[{'user_id': '24705126', 'username': 'ShashiTharoor'}]",
1189153437692448768,1189153437692448768,1572351247000,2019-10-29,17:44:07,India Standard Time,24705126,shashitharoor,Shashi Tharoor,,Happy birthday to your mother! @Tinni_Aphrodite https://twitter.com/Tinni_Aphrodite/status/1189096213448052737 …,['tinni_aphrodite'],['https://twitter.com/Tinni_Aphrodite/status/1189096213448052737'],[],10,24,354,[],[],https://twitter.com/ShashiTharoor/status/1189153437692448768,False,https://twitter.com/Tinni_Aphrodite/status/1189096213448052737,0,,,,,,,"[{'user_id': '24705126', 'username': 'ShashiTharoor'}, {'user_id': '629017102', 'username': 'Tinni_Aphrodite'}]",
1189083108974440448,1189083108974440448,1572334479000,2019-10-29,13:04:39,India Standard Time,24705126,shashitharoor,Shashi Tharoor,,Excellent initiative! The legal system is the only hope for justice & decency in the face of hate speech. https://twitter.com/guptar/status/1189079861370900481 …,[],['https://twitter.com/guptar/status/1189079861370900481'],[],73,337,1967,[],[],https://twitter.com/ShashiTharoor/status/1189083108974440448,False,https://twitter.com/guptar/status/1189079861370900481,0,,,,,,,"[{'user_id': '24705126', 'username': 'ShashiTharoor'}]",
1189079844837117953,1189079844837117953,1572333701000,2019-10-29,12:51:41,India Standard Time,24705126,shashitharoor,Shashi Tharoor,,"Gave a clutch of TV, radio & print interviews. Here are two in today’s Kuwaiti newspapers:  https://news.kuwaittimes.net/website/tharoor-expounds-on-politics-un-literary-escapades/ … &  http://www.arabtimesonline.com/news/dr-tharoor-the-renaissance-man-of-indian-politics-a-voice-of-conscience/ … pic.twitter.com/GLAJ7w6gEE",[],"['https://news.kuwaittimes.net/website/tharoor-expounds-on-politics-un-literary-escapades/', 'http://www.arabtimesonline.com/news/dr-tharoor-the-renaissance-man-of-indian-politics-a-voice-of-conscience/']","['https://pbs.twimg.com/media/EIBteU9X0AAFB2p.jpg', 'https://pbs.twimg.com/media/EIBteU_X4AATIJJ.jpg', 'https://pbs.twimg.com/media/EIBteU8W4AAmjjC.jpg']",12,37,481,[],[],https://twitter.com/ShashiTharoor/status/1189079844837117953,False,,0,,,,,,,"[{'user_id': '24705126', 'username': 'ShashiTharoor'}]",
1189072092010106880,1189072092010106880,1572331853000,2019-10-29,12:20:53,India Standard Time,24705126,shashitharoor,Shashi Tharoor,,"कुमकुम अक्षत थाल सजाए
भाइयों पर अटूट प्रेम बरसाए
बहनों का आज मन हरषाए
भाइयों को प्रेम से तिलक लगाए।

सभी भाई बहनों को #BhaiDooj की हार्दिक शुभकामनाएं pic.twitter.com/bk9Y0ah4lE",[],[],['https://pbs.twimg.com/media/EIBuwtOWsAEmvQT.jpg'],25,51,512,['#bhaidooj'],[],https://twitter.com/ShashiTharoor/status/1189072092010106880,False,,0,,,,,,,"[{'user_id': '24705126', 'username': 'ShashiTharoor'}]",
1189069587444310016,1189069587444310016,1572331256000,2019-10-29,12:10:56,India Standard Time,24705126,shashitharoor,Shashi Tharoor,,"Splendid evening w/the Indian Business & Professional Council of Kuwait. Gave away their prestigious annual awards to Kuwaitis &Indians of excellence, addressed them on “India in Transition” & took many questions. The setting was the interior of the world’s largest wooden boat! pic.twitter.com/e3dZTfeJO2",[],[],"['https://pbs.twimg.com/media/EIBseCNX0AAy7jp.jpg', 'https://pbs.twimg.com/media/EIBseCLW4AI91zL.jpg', 'https://pbs.twimg.com/media/EIBseCDWkAAKRNL.jpg', 'https://pbs.twimg.com/media/EIBseCLWsAYV3Kn.jpg']",10,37,357,[],[],https://twitter.com/ShashiTharoor/status/1189069587444310016,False,,0,,,,,,,"[{'user_id': '24705126', 'username': 'ShashiTharoor'}]",
1189068312686276608,1189068312686276608,1572330952000,2019-10-29,12:05:52,India Standard Time,24705126,shashitharoor,Shashi Tharoor,,Coming up this morning! All in the Salmiyah area of Kuwait are most welcome to attend! pic.twitter.com/oQipvrgLe3,[],[],['https://pbs.twimg.com/media/EIBrUluWsAE2lNq.jpg'],16,24,270,[],[],https://twitter.com/ShashiTharoor/status/1189068312686276608,False,,0,,,,,,,"[{'user_id': '24705126', 'username': 'ShashiTharoor'}]",
1189052860778065920,1189052860778065920,1572327268000,2019-10-29,11:04:28,India Standard Time,24705126,shashitharoor,Shashi Tharoor,,भाई बहन के प्यार के पावन पर्व भाई दूज की आप सभी को बहुत शुभकामनाएं । pic.twitter.com/AxaD0DnrkN,[],[],['https://pbs.twimg.com/media/EIBdRMOXkAAqKn9.jpg'],16,44,606,[],[],https://twitter.com/ShashiTharoor/status/1189052860778065920,False,,0,,,,,,,"[{'user_id': '24705126', 'username': 'ShashiTharoor'}]",
1189049296131428352,1189049296131428352,1572326418000,2019-10-29,10:50:18,India Standard Time,24705126,shashitharoor,Shashi Tharoor,,"The work of a Thiruvananthapuram film-maker!!
 https://twitter.com/RunKalyani  https://twitter.com/arrahman/status/1188472922865897473 …",[],"['https://twitter.com/RunKalyani', 'https://twitter.com/arrahman/status/1188472922865897473']",[],3,23,224,[],[],https://twitter.com/ShashiTharoor/status/1189049296131428352,False,https://twitter.com/arrahman/status/1188472922865897473,0,,,,,,,"[{'user_id': '24705126', 'username': 'ShashiTharoor'}]",
1189046764378185728,1189046764378185728,1572325814000,2019-10-29,10:40:14,India Standard Time,24705126,shashitharoor,Shashi Tharoor,,"This seems very serious. If a hostile power is able to conduct a cyber attack on our nuclear facilities, the implications for India's national security are unimaginable. The Government owes us an explanation. https://twitter.com/RungRage/status/1189019122924806145 …",[],['https://twitter.com/RungRage/status/1189019122924806145'],[],99,900,2589,[],[],https://twitter.com/ShashiTharoor/status/1189046764378185728,False,https://twitter.com/RungRage/status/1189019122924806145,0,,,,,,,"[{'user_id': '24705126', 'username': 'ShashiTharoor'}]",
1188852662890106880,1188802706921738242,1572279537000,2019-10-28,21:48:57,India Standard Time,24705126,shashitharoor,Shashi Tharoor,,This picture is fast becoming the emblematic poster of #Justice4WalayarSisters. Time for the CBI to take cognisance. pic.twitter.com/Y16DzjA4o2,[],[],['https://pbs.twimg.com/media/EH-nL12W4AE7Ak8.jpg'],17,116,554,['#justice4walayarsisters'],[],https://twitter.com/ShashiTharoor/status/1188852662890106880,False,,0,,,,,,,"[{'user_id': '24705126', 'username': 'ShashiTharoor'}]",
1188830197396713472,1188830197396713472,1572274181000,2019-10-28,20:19:41,India Standard Time,24705126,shashitharoor,Shashi Tharoor,,"Greetings from Kuwait, where I have given a few interviews & am about to address the Indian Business & Professional Council this evening. Am with ⁦@DhillonVijay⁩ of @ProfCong. More events scheduled tomorrow before I return overnight. pic.twitter.com/r76yNLKqvk","['dhillonvijay', 'profcong']",[],['https://pbs.twimg.com/media/EH-SwQbX0AEd5rV.jpg'],54,97,1182,[],[],https://twitter.com/ShashiTharoor/status/1188830197396713472,False,,0,,,,,,,"[{'user_id': '24705126', 'username': 'ShashiTharoor'}, {'user_id': '443006491', 'username': 'DhillonVijay'}, {'user_id': '888260883205324800', 'username': 'ProfCong'}]",
1188802706921738242,1188802706921738242,1572267626000,2019-10-28,18:30:26,India Standard Time,24705126,shashitharoor,Shashi Tharoor,,"Given the serious allegations of improper interference in a case against CPI-M workers accused of assaulting two children leading to their deaths, there is a strong argument for the CBI to take over the case. Impunity compounds the crime. https://www.ndtv.com/kerala-news/in-2017-2-girls-were-abused-2-years-on-kerala-court-acquits-3-accused-2123482 …",[],['https://www.ndtv.com/kerala-news/in-2017-2-girls-were-abused-2-years-on-kerala-court-acquits-3-accused-2123482'],[],25,136,725,[],[],https://twitter.com/ShashiTharoor/status/1188802706921738242,False,,0,,,,,,,"[{'user_id': '24705126', 'username': 'ShashiTharoor'}]",
1188799877951741952,1188799877951741952,1572266952000,2019-10-28,18:19:12,India Standard Time,24705126,shashitharoor,Shashi Tharoor,,"My request, made during the LokSabha debate on Article 370, for an All-Party delegation of MPs to visit to see the situation for themselves, has still not been accepted. But members of the EuropeanParliament can travel as our Government's guests? What an #InsultToIndianDemocracy! https://twitter.com/suhasinih/status/1188788676370690048 …",[],['https://twitter.com/suhasinih/status/1188788676370690048'],[],620,2296,7923,['#insulttoindiandemocracy'],[],https://twitter.com/ShashiTharoor/status/1188799877951741952,False,https://twitter.com/suhasinih/status/1188788676370690048,0,,,,,,,"[{'user_id': '24705126', 'username': 'ShashiTharoor'}]",
1188758370364334080,1188758370364334080,1572257056000,2019-10-28,15:34:16,India Standard Time,24705126,shashitharoor,Shashi Tharoor,,"These #WaPoDeathNotices [inspired by @washingtonpost headline for obituary of world's most-wanted terrorist, ISIS founder Abu Bakr al-Baghdadi ] are hilarious! 

Mine: ""Nathuram Godse, eloquent defender of majority rights, passes away in suspended animation at 39"". https://twitter.com/moutet/status/1188627080587685888 …",['washingtonpost'],['https://twitter.com/moutet/status/1188627080587685888'],[],205,332,1824,['#wapodeathnotices'],[],https://twitter.com/ShashiTharoor/status/1188758370364334080,False,https://twitter.com/moutet/status/1188627080587685888,0,,,,,,,"[{'user_id': '24705126', 'username': 'ShashiTharoor'}, {'user_id': '2467791', 'username': 'washingtonpost'}]",
1188754679066443777,1188754679066443777,1572256176000,2019-10-28,15:19:36,India Standard Time,24705126,shashitharoor,Shashi Tharoor,,समस्त देशवासियों को गोवर्धन पूजा की हार्दिक शुभकामनाएं। जय श्री कृष्ण। pic.twitter.com/gGcn2B7Hwf,[],[],['https://pbs.twimg.com/media/EH9OEt-XYAA8FnC.jpg'],51,84,1533,[],[],https://twitter.com/ShashiTharoor/status/1188754679066443777,False,,0,,,,,,,"[{'user_id': '24705126', 'username': 'ShashiTharoor'}]",
1188531821996208129,1188531821996208129,1572203042000,2019-10-28,00:34:02,India Standard Time,24705126,shashitharoor,Shashi Tharoor,,"Sorry to learn of the passing of American South Asianist & security expert StephenP.Cohen. I will never forget his generous praise for my doctoral thesis-turned book #ReasonsOfState. His knowledge, insights & willingness to encourage young scholars will be much missed. RIP.",[],[],[],23,101,1382,['#reasonsofstate'],[],https://twitter.com/ShashiTharoor/status/1188531821996208129,False,,0,,,,,,,"[{'user_id': '24705126', 'username': 'ShashiTharoor'}]",
1188498625610932225,1188498625610932225,1572195128000,2019-10-27,22:22:08,India Standard Time,24705126,shashitharoor,Shashi Tharoor,,The legendary port of Muziris has faded into history. But this 5-minute documentary by @KeralaTourism with a lovely commentary by my sister @ShobhaTharoor brings it back marvellously: https://youtu.be/cOzzAhVA01s ,"['keralatourism', 'shobhatharoor']",['https://youtu.be/cOzzAhVA01s'],[],12,44,333,[],[],https://twitter.com/ShashiTharoor/status/1188498625610932225,False,,0,,,,,,,"[{'user_id': '24705126', 'username': 'ShashiTharoor'}, {'user_id': '19073140', 'username': 'KeralaTourism'}, {'user_id': '1110572250149732352', 'username': 'ShobhaTharoor'}]",
1188477883418730497,1188477883418730497,1572190182000,2019-10-27,20:59:42,India Standard Time,24705126,shashitharoor,Shashi Tharoor,,This Sunday's Word of the Week for @htTweets : authorism: https://www.hindustantimes.com/columns/shashi-tharoor-s-word-of-the-week-authorism/story-NtMQ6iurqeD5196qF046tN.html …,['httweets'],['https://www.hindustantimes.com/columns/shashi-tharoor-s-word-of-the-week-authorism/story-NtMQ6iurqeD5196qF046tN.html'],[],17,48,341,[],[],https://twitter.com/ShashiTharoor/status/1188477883418730497,False,,0,,,,,,,"[{'user_id': '24705126', 'username': 'ShashiTharoor'}, {'user_id': '36327407', 'username': 'htTweets'}]",
1188469980653735937,1188469980653735937,1572188298000,2019-10-27,20:28:18,India Standard Time,24705126,shashitharoor,Shashi Tharoor,,"Superb answers by @KeralaGovernor @arifmohdkha to questions asked by students at a Sunni Islamic seminary:  https://www.youtube.com/watch?v=IyHYmIYkUXk&feature=youtu.be …
Just five minutes to affirm the values of #InclusiveIndia!","['keralagovernor', 'arifmohdkha']",['https://www.youtube.com/watch?v=IyHYmIYkUXk&feature=youtu.be'],[],41,137,765,['#inclusiveindia'],[],https://twitter.com/ShashiTharoor/status/1188469980653735937,False,,0,,,,,,,"[{'user_id': '24705126', 'username': 'ShashiTharoor'}, {'user_id': '786814492659240960', 'username': 'KeralaGovernor'}, {'user_id': '1120868229331558401', 'username': 'arifmohdkha'}]",
1188457360559239168,1188457360559239168,1572185289000,2019-10-27,19:38:09,India Standard Time,24705126,shashitharoor,Shashi Tharoor,,"This is exactly one of the points i have repeatedly made for at least 25 years in favour of a ""Presidential"" system w/a genuine separation of powers among legislature, executive & judiciary. I am glad to see @JP_LOKSATTA making the same case. Our political system needs reform. https://twitter.com/BhanuDhamija/status/1188435834430574593 …",['jp_loksatta'],['https://twitter.com/BhanuDhamija/status/1188435834430574593'],[],56,80,515,[],[],https://twitter.com/ShashiTharoor/status/1188457360559239168,False,https://twitter.com/BhanuDhamija/status/1188435834430574593,0,,,,,,,"[{'user_id': '24705126', 'username': 'ShashiTharoor'}, {'user_id': '242253020', 'username': 'JP_LOKSATTA'}]",
1188184451546669056,1188184451546669056,1572120223000,2019-10-27,01:33:43,India Standard Time,24705126,shashitharoor,Shashi Tharoor,,Happy Diwali to our Indian brothers and sisters of all faiths! pic.twitter.com/6ezbP7gVIr,[],[],"['https://pbs.twimg.com/media/EH1HdM4UcAA9Cae.jpg', 'https://pbs.twimg.com/media/EH1HdM6VAAAwqio.png']",257,325,4810,[],[],https://twitter.com/ShashiTharoor/status/1188184451546669056,False,,0,,,,,,,"[{'user_id': '24705126', 'username': 'ShashiTharoor'}]",
1188157353889124353,1188157353889124353,1572113762000,2019-10-26,23:46:02,India Standard Time,24705126,shashitharoor,Shashi Tharoor,,"Anyone who listens to the interview, which alas very few of those commenting seem to have done, will realise these were the interviewers' words and not mine. https://twitter.com/ShashiTharoor/status/1188087237939851264 …",[],['https://twitter.com/ShashiTharoor/status/1188087237939851264'],[],28,68,626,[],[],https://twitter.com/ShashiTharoor/status/1188157353889124353,False,https://twitter.com/ShashiTharoor/status/1188087237939851264,0,,,,,,,"[{'user_id': '24705126', 'username': 'ShashiTharoor'}]",
1188087237939851264,1188087237939851264,1572097045000,2019-10-26,19:07:25,India Standard Time,24705126,shashitharoor,Shashi Tharoor,,My interview with Karan Thapar today for @thewire_in on current politics after the recent election results: https://www.youtube.com/watch?v=U7eIFu-gBoU …,['thewire_in'],['https://www.youtube.com/watch?v=U7eIFu-gBoU'],[],91,163,1087,[],[],https://twitter.com/ShashiTharoor/status/1188087237939851264,False,,0,,,,,,,"[{'user_id': '24705126', 'username': 'ShashiTharoor'}, {'user_id': '3150940290', 'username': 'thewire_in'}]",
1188086237292138498,1188086237292138498,1572096807000,2019-10-26,19:03:27,India Standard Time,24705126,shashitharoor,Shashi Tharoor,,"Delighted to receive from author @raghavchandra (IAS Retd.) a copy of his new book #KalisDaughter, which explores the prevalence of casteism at the highest echelons of Indian society & government. Looking forward to reading it! pic.twitter.com/E8rhofxeGT",['raghavchandra'],[],"['https://pbs.twimg.com/media/EHzuG_PU0AYqn_9.jpg', 'https://pbs.twimg.com/media/EHzuG_RUcAEscuX.jpg']",10,32,327,['#kalisdaughter'],[],https://twitter.com/ShashiTharoor/status/1188086237292138498,False,,0,,,,,,,"[{'user_id': '24705126', 'username': 'ShashiTharoor'}, {'user_id': '27402811', 'username': 'raghavchandra'}]",
1188053853037449216,1188053853037449216,1572089086000,2019-10-26,16:54:46,India Standard Time,24705126,shashitharoor,Shashi Tharoor,,"Recalling my distinguished predecessor A Charles MP on his death anniversary. We lost him on 26 October 2014. A simple human being & greatly admired, he served 12 years over three terms as Thiruvananthapuram MP. I was privileged to have his blessings and support in my candidacy. pic.twitter.com/3dIzn9LCFO",[],[],"['https://pbs.twimg.com/media/EHzQrbEUUAAOuz3.jpg', 'https://pbs.twimg.com/media/EHzQrbGUwAAiMdy.jpg']",15,93,1198,[],[],https://twitter.com/ShashiTharoor/status/1188053853037449216,False,,0,,,,,,,"[{'user_id': '24705126', 'username': 'ShashiTharoor'}]",
1187928265249288193,1187928265249288193,1572059143000,2019-10-26,08:35:43,India Standard Time,24705126,shashitharoor,Shashi Tharoor,,This is what the farce of the 98% turnout in the BDC elections in #Kashmir really means https://www.telegraphindia.com/india/modis-98-what-it-means/cid/1714352 …,[],['https://www.telegraphindia.com/india/modis-98-what-it-means/cid/1714352'],[],246,776,3377,['#kashmir'],[],https://twitter.com/ShashiTharoor/status/1187928265249288193,False,,0,,,,,,,"[{'user_id': '24705126', 'username': 'ShashiTharoor'}]",
