id,conversation_id,created_at,date,time,timezone,user_id,username,name,place,tweet,mentions,urls,photos,replies_count,retweets_count,likes_count,hashtags,cashtags,link,retweet,quote_url,video,near,geo,source,user_rt_id,user_rt,retweet_id,reply_to,retweet_date
1202544767365611520,1202522074071257088,1575543989000,2019-12-05,16:36:29,India Standard Time,24705126,shashitharoor,Shashi Tharoor,,Did so at the time & in several books and articles. You are wa-a-a-y behind.,"['loveall68866200', 'pchidambaram_in']",[],[],3,0,15,[],[],https://twitter.com/ShashiTharoor/status/1202544767365611520,False,,0,,,,,,,"[{'user_id': '24705126', 'username': 'ShashiTharoor'}, {'user_id': '1192397438998302722', 'username': 'loveall68866200'}, {'user_id': '3097503906', 'username': 'PChidambaram_IN'}]",
1202523624906752005,1202523624906752005,1575538948000,2019-12-05,15:12:28,India Standard Time,24705126,shashitharoor,Shashi Tharoor,,"Enjoyed a long conversation w/the new Ambassador of ⁦@FranceinIndia⁩, EmmanuelLenain. Il m’a offert une occasion de pratiquer mon francais en plus (though his English is excellent). An expert on China& theUS, India is a place of discovery for him. Bienvenue M.l’Ambassadeur! pic.twitter.com/v6b7dYktAl",['franceinindia'],[],"['https://pbs.twimg.com/media/ELA42VTVUAExn3g.jpg', 'https://pbs.twimg.com/media/ELA421TVAAE6lhF.jpg']",11,42,491,[],[],https://twitter.com/ShashiTharoor/status/1202523624906752005,False,,0,,,,,,,"[{'user_id': '24705126', 'username': 'ShashiTharoor'}, {'user_id': '1562957431', 'username': 'FranceinIndia'}]",
1202522074071257088,1202522074071257088,1575538578000,2019-12-05,15:06:18,India Standard Time,24705126,shashitharoor,Shashi Tharoor,,"Delighted to welcome back ⁦@PChidambaram_IN⁩ to Parliament this morning, a free man again! We discussed how, w/ justice finally done to him, it’s time to turn our attention to our Kashmiri colleagues, the political leaders who’ve also been detailed w’out charge for 120 days pic.twitter.com/1qy4VWfSyN",['pchidambaram_in'],[],"['https://pbs.twimg.com/media/ELA3cYCU0AA5KzZ.jpg', 'https://pbs.twimg.com/media/ELA3cydVUAAwIG1.jpg']",324,593,4585,[],[],https://twitter.com/ShashiTharoor/status/1202522074071257088,False,,0,,,,,,,"[{'user_id': '24705126', 'username': 'ShashiTharoor'}, {'user_id': '3097503906', 'username': 'PChidambaram_IN'}]",
1202435950715920386,1202435950715920386,1575518045000,2019-12-05,09:24:05,India Standard Time,24705126,shashitharoor,Shashi Tharoor,,"An amazing visit to the Special Exhibition of Indo-French art currently displayed at the National Museum. Put together by ⁦@alliancefrdelhi⁩ at the initiative of ⁦@dpkpillay12⁩, it’s got some stunning work supported by strong textual material. A must-see! pic.twitter.com/gXlA6Ka1yI","['alliancefrdelhi', 'dpkpillay12']",[],"['https://pbs.twimg.com/media/EK_pFoXUwAAeeqi.jpg', 'https://pbs.twimg.com/media/EK_pGLfUYAAQYBo.jpg', 'https://pbs.twimg.com/media/EK_pG_bUUAA9LMO.jpg', 'https://pbs.twimg.com/media/EK_pHjDUYAMNp8G.jpg']",16,48,556,[],[],https://twitter.com/ShashiTharoor/status/1202435950715920386,False,,0,,,,,,,"[{'user_id': '24705126', 'username': 'ShashiTharoor'}, {'user_id': '499609014', 'username': 'alliancefrdelhi'}, {'user_id': '804847425470857216', 'username': 'dpkpillay12'}]",
1202415056547282945,1202415056547282945,1575513063000,2019-12-05,08:01:03,India Standard Time,24705126,shashitharoor,Shashi Tharoor,,The “Nightingale of India”. Remembered@with admiration https://twitter.com/INCIndia/status/1202414790288670721 …,[],['https://twitter.com/INCIndia/status/1202414790288670721'],[],20,190,1661,[],[],https://twitter.com/ShashiTharoor/status/1202415056547282945,False,https://twitter.com/INCIndia/status/1202414790288670721,0,,,,,,,"[{'user_id': '24705126', 'username': 'ShashiTharoor'}]",
1202299791499096064,1202299791499096064,1575485582000,2019-12-05,00:23:02,India Standard Time,24705126,shashitharoor,Shashi Tharoor,,"To the many people from Thiruvananthapuram & elsewhere who sought my intercession in the SreeChitra Medical Institute fee issue, here’s my letter on Monday to the Minister which I am following up with ⁦@drharshvardhan⁩. More Govt funding is the only way out. pic.twitter.com/lNoPq6TRXO",['drharshvardhan'],[],['https://pbs.twimg.com/media/EK9tR_SVUAEjNOo.jpg'],16,63,343,[],[],https://twitter.com/ShashiTharoor/status/1202299791499096064,False,,0,,,,,,,"[{'user_id': '24705126', 'username': 'ShashiTharoor'}, {'user_id': '77732185', 'username': 'drharshvardhan'}]",
1202292948840222720,1202292948840222720,1575483951000,2019-12-04,23:55:51,India Standard Time,24705126,shashitharoor,Shashi Tharoor,,"Shiv Sena, Congress Slam Government In Lok Sabha Over Economy https://www.ndtv.com/india-news/shiv-sena-congress-slam-government-in-lok-sabha-over-economy-2143502?amp=1&akamai-rum=off …",[],['https://www.ndtv.com/india-news/shiv-sena-congress-slam-government-in-lok-sabha-over-economy-2143502?amp=1&akamai-rum=off'],[],57,287,2052,[],[],https://twitter.com/ShashiTharoor/status/1202292948840222720,False,,0,,,,,,,"[{'user_id': '24705126', 'username': 'ShashiTharoor'}]",
1202292124248489984,1202292124248489984,1575483754000,2019-12-04,23:52:34,India Standard Time,24705126,shashitharoor,Shashi Tharoor,,"Communist SFI goons now vandalise the car of a University College Thiruvananthapuram professor:  https://www.mathrubhumi.com/print-edition/kerala/university-college-professors-car-vandalised-1.4331649 …. Between the intimidatory nationalism of the BJP &lumpen violence of the Left, who will stand up4the moderate sane progressive voices on Kerala campuses? @nsui",['nsui'],['https://www.mathrubhumi.com/print-edition/kerala/university-college-professors-car-vandalised-1.4331649'],[],36,89,414,[],[],https://twitter.com/ShashiTharoor/status/1202292124248489984,False,,0,,,,,,,"[{'user_id': '24705126', 'username': 'ShashiTharoor'}, {'user_id': '16323656', 'username': 'nsui'}]",
1202247217152589830,1202247217152589830,1575473047000,2019-12-04,20:54:07,India Standard Time,24705126,shashitharoor,Shashi Tharoor,,Screen-grabs from today’s Lok Sabha debate sent by a fan: the many moods prompted by the Supplementary Demands for Grants! pic.twitter.com/pO3UNiNrqo,[],[],"['https://pbs.twimg.com/media/EK89bqZUUAEx-xV.jpg', 'https://pbs.twimg.com/media/EK89cSxUYAAdbHL.jpg', 'https://pbs.twimg.com/media/EK89dAjUYAIDp_O.jpg', 'https://pbs.twimg.com/media/EK89dnGU0AUrtlD.jpg']",59,88,915,[],[],https://twitter.com/ShashiTharoor/status/1202247217152589830,False,,0,,,,,,,"[{'user_id': '24705126', 'username': 'ShashiTharoor'}]",
1202242754278916103,1202241607702990849,1575471983000,2019-12-04,20:36:23,India Standard Time,24705126,shashitharoor,Shashi Tharoor,,"The young lady in the wheelchair, Pratishtha Deveshwar, was paralysed by an accident after which she was left to bleed on the side of the road for hours as indifferent people drove past. She is now a crusader for road safety. https://youtu.be/Xr9dNZV-8DY ",[],['https://youtu.be/Xr9dNZV-8DY'],[],12,38,324,[],[],https://twitter.com/ShashiTharoor/status/1202242754278916103,False,,0,,,,,,,"[{'user_id': '24705126', 'username': 'ShashiTharoor'}]",
1202241607702990849,1202241607702990849,1575471710000,2019-12-04,20:31:50,India Standard Time,24705126,shashitharoor,Shashi Tharoor,,At the #RoadSafety conference organised by ⁦@TheQuint⁩ yesterday after an excellent 20-minute conversation w/ ⁦@raghav_bahl  on the problem & on what India can & should do about it. With just 1% if th world’s vehicles we have the highest traffic fatalities on earth pic.twitter.com/7EfyMgP2pk,"['thequint', 'raghav_bahl']",[],"['https://pbs.twimg.com/media/EK84RKZU4AADhKz.jpg', 'https://pbs.twimg.com/media/EK84WIYVAAA5Xn8.jpg']",27,75,650,['#roadsafety'],[],https://twitter.com/ShashiTharoor/status/1202241607702990849,False,,0,,,,,,,"[{'user_id': '24705126', 'username': 'ShashiTharoor'}, {'user_id': '2982269822', 'username': 'TheQuint'}, {'user_id': '169058509', 'username': 'Raghav_Bahl'}]",
1202231729227849729,1202095563270971392,1575469355000,2019-12-04,19:52:35,India Standard Time,24705126,shashitharoor,Shashi Tharoor,,I asked for that in my Parliament speech today.,['sabina222'],[],[],2,0,13,[],[],https://twitter.com/ShashiTharoor/status/1202231729227849729,False,,0,,,,,,,"[{'user_id': '24705126', 'username': 'ShashiTharoor'}, {'user_id': '175732148', 'username': 'sabina222'}]",
1202231421177253888,1202231421177253888,1575469281000,2019-12-04,19:51:21,India Standard Time,24705126,shashitharoor,Shashi Tharoor,,"Sorry to say that @nsitharaman’s detailed reply on the Supplementary Demands for Grants completely sidestepped the key issues I raised: how will Govt meet its revenue projections when collections so far are 45% in 7months, &keep2its fiscal deficit target?   https://loksabhatv.nic.in/sites/default/files/videos/speeches/shashi%20tharoor%204dec.mp4 …",['nsitharaman'],['https://loksabhatv.nic.in/sites/default/files/videos/speeches/shashi%20tharoor%204dec.mp4'],[],54,258,1290,[],[],https://twitter.com/ShashiTharoor/status/1202231421177253888,False,,0,,,,,,,"[{'user_id': '24705126', 'username': 'ShashiTharoor'}, {'user_id': '58243368', 'username': 'nsitharaman'}]",
1202201686518816769,1201821790948872193,1575462192000,2019-12-04,17:53:12,India Standard Time,24705126,shashitharoor,Shashi Tharoor,,I raised the issue in the course of my Parliament speech today on the Government’s Supplementary Demands for Grants. Will issue the video as soon as we can get it.,"['cleviic', 'omarabdullah', 'mehboobamufti']",[],[],2,7,38,[],[],https://twitter.com/ShashiTharoor/status/1202201686518816769,False,,0,,,,,,,"[{'user_id': '24705126', 'username': 'ShashiTharoor'}, {'user_id': '833363024', 'username': 'cleviic'}, {'user_id': '138822469', 'username': 'OmarAbdullah'}, {'user_id': '2647058209', 'username': 'MehboobaMufti'}]",
1202200334161940480,1202200334161940480,1575461870000,2019-12-04,17:47:50,India Standard Time,24705126,shashitharoor,Shashi Tharoor,,"My question in the LokSabha yesterday on whether India is being wise in trying to expand cultivation of palm oil, given its environmental consequences & financial unviability. Unfortunately the Minister’s answer suggests he may not have got the thrust of my argument. pic.twitter.com/z4vZgQOSnp",[],[],[],132,354,2015,[],[],https://twitter.com/ShashiTharoor/status/1202200334161940480,False,,1,,,,,,,"[{'user_id': '24705126', 'username': 'ShashiTharoor'}]",
1202095563270971392,1202095563270971392,1575436890000,2019-12-04,10:51:30,India Standard Time,24705126,shashitharoor,Shashi Tharoor,,But justice delayed is justice denied. This should have been granted much earlier. Nothing is different from three months ago. https://twitter.com/Nidhi/status/1202092613635133440 …,[],['https://twitter.com/Nidhi/status/1202092613635133440'],[],762,1221,7806,[],[],https://twitter.com/ShashiTharoor/status/1202095563270971392,False,https://twitter.com/Nidhi/status/1202092613635133440,0,,,,,,,"[{'user_id': '24705126', 'username': 'ShashiTharoor'}]",
1201927444732600320,1201927444732600320,1575396808000,2019-12-03,23:43:28,India Standard Time,24705126,shashitharoor,Shashi Tharoor,,Best wishes to the striking couple! Wishing you a long and blissful married life. @ramdasrocks https://twitter.com/VenesaHermijil/status/1201831398698446849 …,['ramdasrocks'],['https://twitter.com/VenesaHermijil/status/1201831398698446849'],[],8,50,742,[],[],https://twitter.com/ShashiTharoor/status/1201927444732600320,False,https://twitter.com/VenesaHermijil/status/1201831398698446849,0,,,,,,,"[{'user_id': '24705126', 'username': 'ShashiTharoor'}, {'user_id': '91965828', 'username': 'ramdasrocks'}]",
1201886747891646465,1201882833586921478,1575387105000,2019-12-03,21:01:45,India Standard Time,24705126,shashitharoor,Shashi Tharoor,,It is indeed shameful that a professor can be fired for upholding University rules.,"['anandkamal', 'rishi_suri', 'surinavin', 'irfhabib', 'atiyaz', 'singharchive']",[],[],12,15,73,[],[],https://twitter.com/ShashiTharoor/status/1201886747891646465,False,,0,,,,,,,"[{'user_id': '24705126', 'username': 'ShashiTharoor'}, {'user_id': '71221321', 'username': 'anandkamal'}, {'user_id': '24665440', 'username': 'rishi_suri'}, {'user_id': '2783611740', 'username': 'SuriNavin'}, {'user_id': '94022742', 'username': 'irfhabib'}, {'user_id': '73431630', 'username': 'atiyaz'}, {'user_id': '1029446366894800896', 'username': 'SinghArchive'}]",
1201819199913381889,1201819199913381889,1575371000000,2019-12-03,16:33:20,India Standard Time,24705126,shashitharoor,Shashi Tharoor,,"Our government doesn’t work & doesn’t create meaningful work for our people. 5 lakh including MBA, Engineers, postgraduates apply to become gardener &watchman in Bihar!: https://www.indiatoday.in/mail-today/story/5-lakh-including-mba-engineers-post-graduates-apply-to-become-gardener-and-watchman-in-bihar-1623159-2019-11-28 …",[],['https://www.indiatoday.in/mail-today/story/5-lakh-including-mba-engineers-post-graduates-apply-to-become-gardener-and-watchman-in-bihar-1623159-2019-11-28'],[],426,863,3387,[],[],https://twitter.com/ShashiTharoor/status/1201819199913381889,False,,0,,,,,,,"[{'user_id': '24705126', 'username': 'ShashiTharoor'}]",
1201708909272039425,1201708909272039425,1575344705000,2019-12-03,09:15:05,India Standard Time,24705126,shashitharoor,Shashi Tharoor,,One has to admit that TV camera work in cricket matches has immeasurably improved since then. https://twitter.com/anandkamal/status/1201705536720211969 …,[],['https://twitter.com/anandkamal/status/1201705536720211969'],[],15,32,384,[],[],https://twitter.com/ShashiTharoor/status/1201708909272039425,False,https://twitter.com/anandkamal/status/1201705536720211969,0,,,,,,,"[{'user_id': '24705126', 'username': 'ShashiTharoor'}]",
1201539308559093760,1201539308559093760,1575304269000,2019-12-02,22:01:09,India Standard Time,24705126,shashitharoor,Shashi Tharoor,,"My intervention in the LokSabha today calling for central Government assistance to rescue the water bodies in Thiruvananthapuram that are in danger of drying up, choking or otherwise disappearing: pic.twitter.com/R7UHUk986q",[],[],[],44,174,1395,[],[],https://twitter.com/ShashiTharoor/status/1201539308559093760,False,,1,,,,,,,"[{'user_id': '24705126', 'username': 'ShashiTharoor'}]",
1201514617312165888,1201514617312165888,1575298382000,2019-12-02,20:23:02,India Standard Time,24705126,shashitharoor,Shashi Tharoor,,Brilliant idea! https://twitter.com/Raageshwari1/status/1201507837773524992 …,[],['https://twitter.com/Raageshwari1/status/1201507837773524992'],[],65,245,2051,[],[],https://twitter.com/ShashiTharoor/status/1201514617312165888,False,https://twitter.com/Raageshwari1/status/1201507837773524992,0,,,,,,,"[{'user_id': '24705126', 'username': 'ShashiTharoor'}]",
1201486506294071296,1201486506294071296,1575291680000,2019-12-02,18:31:20,India Standard Time,24705126,shashitharoor,Shashi Tharoor,,Terrific work by @rejitweets for his pre-departure orientation sessions for potential migrants who are planning to move to the Gulf in search of a job from the coastal areas of Thiruvananthapuram. All Malayalis will find this thread useful. https://twitter.com/rejitweets/status/1200669215901904896 …,['rejitweets'],['https://twitter.com/rejitweets/status/1200669215901904896'],[],11,41,220,[],[],https://twitter.com/ShashiTharoor/status/1201486506294071296,False,https://twitter.com/rejitweets/status/1200669215901904896,0,,,,,,,"[{'user_id': '24705126', 'username': 'ShashiTharoor'}, {'user_id': '253023206', 'username': 'rejitweets'}]",
1201148507215687680,1200996362268995585,1575211095000,2019-12-01,20:08:15,India Standard Time,24705126,shashitharoor,Shashi Tharoor,,Yes!,"['varunjjose', 'davidwarner31']",[],[],0,0,3,[],[],https://twitter.com/ShashiTharoor/status/1201148507215687680,False,,0,,,,,,,"[{'user_id': '24705126', 'username': 'ShashiTharoor'}, {'user_id': '1333243466', 'username': 'varunjjose'}, {'user_id': '127765218', 'username': 'davidwarner31'}]",
1201147272936820736,1201147272936820736,1575210800000,2019-12-01,20:03:20,India Standard Time,24705126,shashitharoor,Shashi Tharoor,,Addressed the mass rally of the Kerala Latin Catholic community in Neyyattinkara. Some 2 lakh people thronged the highway in kilometres-long processions. The community’s legitimate demands require a fair hearing from the State Government. pic.twitter.com/jHqefzI9Dv,[],[],"['https://pbs.twimg.com/media/EKtU4TmUUAAFTEr.jpg', 'https://pbs.twimg.com/media/EKtU7-8VAAAmVVS.jpg', 'https://pbs.twimg.com/media/EKtVBBjUYAA4IK8.jpg']",17,45,398,[],[],https://twitter.com/ShashiTharoor/status/1201147272936820736,False,,0,,,,,,,"[{'user_id': '24705126', 'username': 'ShashiTharoor'}]",
1201145728527036418,1201145728527036418,1575210432000,2019-12-01,19:57:12,India Standard Time,24705126,shashitharoor,Shashi Tharoor,,Delightful to meet some of my friendly young constituents! Here with ⁦@Asianet⁩ cameraman Kannan & his lovely kids pic.twitter.com/G6yoqxgMQD,['asianet'],[],['https://pbs.twimg.com/media/EKtTqhUUcAAL96e.jpg'],23,59,794,[],[],https://twitter.com/ShashiTharoor/status/1201145728527036418,False,,0,,,,,,,"[{'user_id': '24705126', 'username': 'ShashiTharoor'}, {'user_id': '1116083970', 'username': 'asianet'}]",
1201145350146293765,1201145350146293765,1575210342000,2019-12-01,19:55:42,India Standard Time,24705126,shashitharoor,Shashi Tharoor,,Some of the many weddings & marriage receptions I attended in my constituency this weekend. It’s the season!! pic.twitter.com/GkMcN8F5nN,[],[],"['https://pbs.twimg.com/media/EKtTR12VUAAJ7gC.jpg', 'https://pbs.twimg.com/media/EKtTSkDUcAI6S6V.jpg', 'https://pbs.twimg.com/media/EKtTTMYUwAUVGFK.jpg', 'https://pbs.twimg.com/media/EKtTT3DUYAU254G.jpg']",50,79,1430,[],[],https://twitter.com/ShashiTharoor/status/1201145350146293765,False,,0,,,,,,,"[{'user_id': '24705126', 'username': 'ShashiTharoor'}]",
1201143596612612097,1191749836954980357,1575209924000,2019-12-01,19:48:44,India Standard Time,24705126,shashitharoor,Shashi Tharoor,,Delighted the fishermen made it back safely to Thiruvananthapuram & came to see me this morning! My thanks to Lakshadweep MP @Faizalpp786 & local authorities for all their help. It’s a tough job being at the mercy of the seas. pic.twitter.com/Q3W8sgF75r,['faizalpp786'],[],['https://pbs.twimg.com/media/EKtRt81U8AMvqs6.jpg'],10,26,286,[],[],https://twitter.com/ShashiTharoor/status/1201143596612612097,False,,0,,,,,,,"[{'user_id': '24705126', 'username': 'ShashiTharoor'}, {'user_id': '587297260', 'username': 'faizalpp786'}]",
1201142181735518209,1201142181735518209,1575209586000,2019-12-01,19:43:06,India Standard Time,24705126,shashitharoor,Shashi Tharoor,,"Chidambaram Arrest: 100 Days and Counting, yet What Has Been Proven? ⁦@SupriyaShrinate⁩  asks. This entire exercise has tarnished our justice system’s reputation for fairness. ⁦@PChidambaram_IN⁩ ⁦@KartiPC⁩ https://thewire.in/rights/chidambaram-arrest-100-days-and-counting-yet-what-has-been-proven …","['supriyashrinate', 'pchidambaram_in', 'kartipc']",['https://thewire.in/rights/chidambaram-arrest-100-days-and-counting-yet-what-has-been-proven'],[],370,841,3352,[],[],https://twitter.com/ShashiTharoor/status/1201142181735518209,False,,0,,,,,,,"[{'user_id': '24705126', 'username': 'ShashiTharoor'}, {'user_id': '342096051', 'username': 'SupriyaShrinate'}, {'user_id': '3097503906', 'username': 'PChidambaram_IN'}, {'user_id': '50279201', 'username': 'KartiPC'}]",
1200996962209689602,1200996362268995585,1575174963000,2019-12-01,10:06:03,India Standard Time,24705126,shashitharoor,Shashi Tharoor,,"Part of the pleasure of cricket is its records. Figures &statistics continue to enthral the true aficionado. Cricket teams should go for records when they can. With the 1st Test in the bag & victory likely against a weak Pak side (which was soon reduced to 89 for 6), why declare?",['davidwarner31'],[],[],49,45,535,[],[],https://twitter.com/ShashiTharoor/status/1200996962209689602,False,,0,,,,,,,"[{'user_id': '24705126', 'username': 'ShashiTharoor'}, {'user_id': '127765218', 'username': 'davidwarner31'}]",
1200996362268995585,1200996362268995585,1575174820000,2019-12-01,10:03:40,India Standard Time,24705126,shashitharoor,Shashi Tharoor,,"This summer, @davidwarner31 made 95 runs in 10 innings in the Ashes series against England. Against Pak, he scored 150+ in the 1st Test last week & followed it up with 335 not out yesterday in the 2nd. An unnecessary premature declaration cost him a shot at the world record. Pity",['davidwarner31'],[],[],106,168,2584,[],[],https://twitter.com/ShashiTharoor/status/1200996362268995585,False,,0,,,,,,,"[{'user_id': '24705126', 'username': 'ShashiTharoor'}, {'user_id': '127765218', 'username': 'davidwarner31'}]",
1200995567163232256,1200995567163232256,1575174631000,2019-12-01,10:00:31,India Standard Time,24705126,shashitharoor,Shashi Tharoor,,Out in January! Pre-order now! https://twitter.com/mark_mybook/status/1200691161272160258 …,[],['https://twitter.com/mark_mybook/status/1200691161272160258'],[],63,71,518,[],[],https://twitter.com/ShashiTharoor/status/1200995567163232256,False,https://twitter.com/mark_mybook/status/1200691161272160258,0,,,,,,,"[{'user_id': '24705126', 'username': 'ShashiTharoor'}]",
1200991032155881473,1200991032155881473,1575173550000,2019-12-01,09:42:30,India Standard Time,24705126,shashitharoor,Shashi Tharoor,,One of the many reasons I’m proud to be a Keralite! What can be of greater value than giving life to an orphan’s dreams? This heartwarming story captures much of what Malayali culture is about: https://www.newindianexpress.com/states/kerala/2019/dec/01/kerala-taught-this-kashmiri-urdu-made-him-a-poet-2069600.html …,[],['https://www.newindianexpress.com/states/kerala/2019/dec/01/kerala-taught-this-kashmiri-urdu-made-him-a-poet-2069600.html'],[],61,357,2223,[],[],https://twitter.com/ShashiTharoor/status/1200991032155881473,False,,0,,,,,,,"[{'user_id': '24705126', 'username': 'ShashiTharoor'}]",
1200987778353225728,1200786215504470018,1575172774000,2019-12-01,09:29:34,India Standard Time,24705126,shashitharoor,Shashi Tharoor,,"തിരുവനന്തപുരത്ത്‌ എം.വി. ശ്രേയാംസ്‌കുമാറിന്റെ 'യാത്ര പറയാതെ' എന്ന പുസ്തകത്തിന്റെ പ്രകാശന ചടങ്ങ്‌
 http://dhunt.in/7HDCi?s=a&ss=wsp …
Source : ""മാതൃഭൂമി"" via Dailyhunt",[],['http://dhunt.in/7HDCi?s=a&ss=wsp'],[],2,8,65,[],[],https://twitter.com/ShashiTharoor/status/1200987778353225728,False,,0,,,,,,,"[{'user_id': '24705126', 'username': 'ShashiTharoor'}]",
1200825936611930112,1200333177723576321,1575134188000,2019-11-30,22:46:28,India Standard Time,24705126,shashitharoor,Shashi Tharoor,,Happy birthday @eldhio_aipc! May this be a happy & fulfilling year of fighting for #InclusiveIndia!,"['venesahermijil', 'aipckochi', 'eldho_aipc', 'inctharoorian', 'sindhu_ranjith', 'katie_abraham', 'siju_geo', 'anthonyathomas', 'jayasreevijayan', 'sceeko', 'rajupnair', 'koyikkodann']",[],[],0,6,23,['#inclusiveindia'],[],https://twitter.com/ShashiTharoor/status/1200825936611930112,False,,0,,,,,,,"[{'user_id': '24705126', 'username': 'ShashiTharoor'}, {'user_id': '2556875153', 'username': 'VenesaHermijil'}, {'user_id': '988076380909957120', 'username': 'AipcKochi'}, {'user_id': '875104626973880320', 'username': 'Eldho_aipc'}, {'user_id': '49264202', 'username': 'INCTharoorian'}, {'user_id': '162347599', 'username': 'sindhu_ranjith'}, {'user_id': '134410015', 'username': 'katie_abraham'}, {'user_id': '35790057', 'username': 'siju_geo'}, {'user_id': '3109241382', 'username': 'AnthonyAThomas'}, {'user_id': '1078999172', 'username': 'JayasreeVijayan'}, {'user_id': '1046632771244847104', 'username': 'SCeeko'}, {'user_id': '62455476', 'username': 'RajuPNair'}, {'user_id': '738435051147272192', 'username': 'KoYiKkoDaNn'}]",
1200796725054603264,1200796725054603264,1575127223000,2019-11-30,20:50:23,India Standard Time,24705126,shashitharoor,Shashi Tharoor,,Happy Birthday @jameelsjam ! May you have a splendid day and a wonderful year ahead!! https://twitter.com/Aneela_7/status/1200739189253275648 …,['jameelsjam'],['https://twitter.com/Aneela_7/status/1200739189253275648'],[],14,19,192,[],[],https://twitter.com/ShashiTharoor/status/1200796725054603264,False,https://twitter.com/Aneela_7/status/1200739189253275648,0,,,,,,,"[{'user_id': '24705126', 'username': 'ShashiTharoor'}, {'user_id': '1923602274', 'username': 'jameelsjam'}]",
1200793545348530177,1200793545348530177,1575126465000,2019-11-30,20:37:45,India Standard Time,24705126,shashitharoor,Shashi Tharoor,,Prayers for the brave jawans & condolences to their families. We have lost more soldiers to the weather in Siachen than to shelling or action there. https://twitter.com/capt_amarinder/status/1200790828735614978 …,[],['https://twitter.com/capt_amarinder/status/1200790828735614978'],[],25,249,1519,[],[],https://twitter.com/ShashiTharoor/status/1200793545348530177,False,https://twitter.com/capt_amarinder/status/1200790828735614978,0,,,,,,,"[{'user_id': '24705126', 'username': 'ShashiTharoor'}]",
1200788200249163776,1200788200249163776,1575125191000,2019-11-30,20:16:31,India Standard Time,24705126,shashitharoor,Shashi Tharoor,,"With the Grand Old Man of Kerala publishing, litterateur, orator &President of the Kerala State JanataDal(U) [which broke away from NitishKumar when he turned coat] Shri MP VeerendraKumar, MP. An honour to count him as a friend & well-wisher in the turbulence of Kerala politics. pic.twitter.com/oy8fdT8f1f",[],[],['https://pbs.twimg.com/media/EKoOf2CUYAUx_da.jpg'],11,51,614,[],[],https://twitter.com/ShashiTharoor/status/1200788200249163776,False,,0,,,,,,,"[{'user_id': '24705126', 'username': 'ShashiTharoor'}]",
