id,conversation_id,created_at,date,time,timezone,user_id,username,name,place,tweet,mentions,urls,photos,replies_count,retweets_count,likes_count,hashtags,cashtags,link,retweet,quote_url,video,near,geo,source,user_rt_id,user_rt,retweet_id,reply_to,retweet_date
1177549702172164096,1177549702172164096,1569584701000,2019-09-27,17:15:01,India Standard Time,24705126,shashitharoor,Shashi Tharoor,,"2yrs on, probe clears DrKafeel in death of kids due to lack of O2 -  http://toi.in/Q9k2yY21/a31gj . Wonder if his exoneration will get a tenth of the media space the charges did;&whether our authorities &those baying for his blood will have any shame about depriving him of 2yrs of life",[],['http://toi.in/Q9k2yY21/a31gj'],[],142,728,2849,[],[],https://twitter.com/ShashiTharoor/status/1177549702172164096,False,,0,,,,,,,"[{'user_id': '24705126', 'username': 'ShashiTharoor'}]",
1177177756930588673,1177177756930588673,1569496022000,2019-09-26,16:37:02,India Standard Time,24705126,shashitharoor,Shashi Tharoor,,"Happy Birthday & many happy returns of the day to former PM Manmohan Singh, who turns 87 today. He transformed the lives of millions of Indians through his policies as Finance &Prime Minister, as I explained in this 2012 article:  https://www.bbc.com/news/world-asia-india-19709596 …
#HappyBirthdayDrSingh",[],['https://www.bbc.com/news/world-asia-india-19709596'],[],176,850,6122,['#happybirthdaydrsingh'],[],https://twitter.com/ShashiTharoor/status/1177177756930588673,False,,0,,,,,,,"[{'user_id': '24705126', 'username': 'ShashiTharoor'}]",
1177045987866681345,1177045987866681345,1569464606000,2019-09-26,07:53:26,India Standard Time,24705126,shashitharoor,Shashi Tharoor,,"An expert says that communication blackouts are ""certainly not the right instruments to achieve long-lasting peace"":  https://www.huffingtonpost.in/entry/kashmir-blackout-could-backfire-narendra-modi-govt-expert-explains_in_5d8a1f7fe4b0c2a85cb18de1?guccounter=1&guce_referrer=aHR0cHM6Ly93d3cuaHVmZmluZ3RvbnBvc3QuaW4v&guce_referrer_sig=AQAAAD_ScmOXHFFAjZxdxChNA6WIOU5OjOhC1MHg-RifCd0OaDX_1rjnCrkkz0AimwMRCltvLg9XbwoIngPWab7Rk8F4AIFa1EWtXxcbWv5oyb8vUbXgap7astraFXqNtXLiDyaBtpfYMBRfcKsw5zCXeyxTzk9RVKICw8qNTK7SXLOj …
Such restrictions foment distrust, encourage false information, & as in Egypt in 2011, lead to worse protests.
#Kashmir #EndTheLockdownNow!",[],['https://www.huffingtonpost.in/entry/kashmir-blackout-could-backfire-narendra-modi-govt-expert-explains_in_5d8a1f7fe4b0c2a85cb18de1?guccounter=1&guce_referrer=aHR0cHM6Ly93d3cuaHVmZmluZ3RvbnBvc3QuaW4v&guce_referrer_sig=AQAAAD_ScmOXHFFAjZxdxChNA6WIOU5OjOhC1MHg-RifCd0OaDX_1rjnCrkkz0AimwMRCltvLg9XbwoIngPWab7Rk8F4AIFa1EWtXxcbWv5oyb8vUbXgap7astraFXqNtXLiDyaBtpfYMBRfcKsw5zCXeyxTzk9RVKICw8qNTK7SXLOj'],[],188,426,1551,"['#kashmir', '#endthelockdownnow']",[],https://twitter.com/ShashiTharoor/status/1177045987866681345,False,,0,,,,,,,"[{'user_id': '24705126', 'username': 'ShashiTharoor'}]",
1177044342432833540,1177044342432833540,1569464214000,2019-09-26,07:46:54,India Standard Time,24705126,shashitharoor,Shashi Tharoor,,"The demand for more trains to stop at Kazhakootam station is a reasonable one, which i have made repeatedly, with only partial success. I raised it again in my meeting with @TVC138 last month. The Rlwy authorities' apathy is incomprehensible. @PiyushGoyal http://www.newindianexpress.com/cities/thiruvananthapuram/2019/sep/26/techies-demand-stop-for-more-trains-at-kazhakootam-2039100.html …","['tvc138', 'piyushgoyal']",['http://www.newindianexpress.com/cities/thiruvananthapuram/2019/sep/26/techies-demand-stop-for-more-trains-at-kazhakootam-2039100.html'],[],33,93,521,[],[],https://twitter.com/ShashiTharoor/status/1177044342432833540,False,,0,,,,,,,"[{'user_id': '24705126', 'username': 'ShashiTharoor'}, {'user_id': '3145899408', 'username': 'TVC138'}, {'user_id': '1324334436', 'username': 'PiyushGoyal'}]",
1177031202043305985,1177031202043305985,1569461081000,2019-09-26,06:54:41,India Standard Time,24705126,shashitharoor,Shashi Tharoor,,"Of historical interest: film footage of that first arrival in 1949, & his second visit in 1956 when then Vice-President Nixon received him at the airport & President Eisenhower welcomed him at home:  https://www.youtube.com/watch?v=D0vuezz0DuY&feature=youtu.be … And with JFK in 1961:  https://www.youtube.com/watch?v=ND5k14av7CM&feature=youtu.be … https://twitter.com/ShashiTharoor/status/1176605771695566850 …",[],"['https://www.youtube.com/watch?v=D0vuezz0DuY&feature=youtu.be', 'https://www.youtube.com/watch?v=ND5k14av7CM&feature=youtu.be', 'https://twitter.com/ShashiTharoor/status/1176605771695566850']",[],581,427,2278,[],[],https://twitter.com/ShashiTharoor/status/1177031202043305985,False,https://twitter.com/ShashiTharoor/status/1176605771695566850,0,,,,,,,"[{'user_id': '24705126', 'username': 'ShashiTharoor'}]",
1176886219172712449,1176886219172712449,1569426514000,2019-09-25,21:18:34,India Standard Time,24705126,shashitharoor,Shashi Tharoor,,"I've been arguing for some time that thanks to Bollywood & growing national integration, Hindi was winning anyway & no imposition is required. This article confirms the growth of Hindi as the ""2nd language"" of choice even among South Indians:
 https://amp.scroll.in/article/937857/why-are-south-indians-speaking-hindi-to-each-other …
@AmitShah",['amitshah'],['https://amp.scroll.in/article/937857/why-are-south-indians-speaking-hindi-to-each-other'],[],153,261,1623,[],[],https://twitter.com/ShashiTharoor/status/1176886219172712449,False,,0,,,,,,,"[{'user_id': '24705126', 'username': 'ShashiTharoor'}, {'user_id': '1447949844', 'username': 'AmitShah'}]",
1176857374696587265,1176857374696587265,1569419637000,2019-09-25,19:23:57,India Standard Time,24705126,shashitharoor,Shashi Tharoor,,"Congratulations @anandmahindra! Thiruvananthapuram is proud to be associated with your new revolutionary e-auto, the #TrivandrumTreo! Looking forward to a ride in it soon in my constituency! https://twitter.com/anandmahindra/status/1176811563925331969 …",['anandmahindra'],['https://twitter.com/anandmahindra/status/1176811563925331969'],[],24,57,735,['#trivandrumtreo'],[],https://twitter.com/ShashiTharoor/status/1176857374696587265,False,https://twitter.com/anandmahindra/status/1176811563925331969,0,,,,,,,"[{'user_id': '24705126', 'username': 'ShashiTharoor'}, {'user_id': '34197952', 'username': 'anandmahindra'}]",
1176848104919904256,1176848104919904256,1569417427000,2019-09-25,18:47:07,India Standard Time,24705126,shashitharoor,Shashi Tharoor,,"My interview in Hindi with @TedhiLakeer of @TheQuint, on #TheHinduWay: https://www.youtube.com/watch?v=crClJ3LuOl0 …","['tedhilakeer', 'thequint']",['https://www.youtube.com/watch?v=crClJ3LuOl0'],[],75,53,269,['#thehinduway'],[],https://twitter.com/ShashiTharoor/status/1176848104919904256,False,,0,,,,,,,"[{'user_id': '24705126', 'username': 'ShashiTharoor'}, {'user_id': '143114327', 'username': 'TedhiLakeer'}, {'user_id': '2982269822', 'username': 'TheQuint'}]",
1176842050391748613,1176842050391748613,1569415984000,2019-09-25,18:23:04,India Standard Time,24705126,shashitharoor,Shashi Tharoor,,"What Indian media did not show: the other messaging by NRI protestors in Houston. They are not anti-Hindu, they are mainly proud Hindus who object to the hijacking of Hinduism by bigots, lynchers & vigilantes. pic.twitter.com/TiF7Ca0YKF",[],[],"['https://pbs.twimg.com/media/EFT7mVIXoAAtkJb.jpg', 'https://pbs.twimg.com/media/EFT7mloW4AMjjyz.jpg', 'https://pbs.twimg.com/media/EFT7mx9X4AEi4gk.jpg']",3786,5517,20564,[],[],https://twitter.com/ShashiTharoor/status/1176842050391748613,False,,0,,,,,,,"[{'user_id': '24705126', 'username': 'ShashiTharoor'}]",
1176605771695566850,1176529302822764544,1569359650000,2019-09-25,02:44:10,India Standard Time,24705126,shashitharoor,Shashi Tharoor,,Jawaharlal Nehru remains the only Indian Prime Minister to be greeted on arrival at the airport by a US President —& it happened twice: President Harry S Truman in 1949 & President John F Kennedy in 1961 both received him off the plane.,[],[],[],1584,1223,6072,[],[],https://twitter.com/ShashiTharoor/status/1176605771695566850,False,,0,,,,,,,"[{'user_id': '24705126', 'username': 'ShashiTharoor'}]",
1176577464816087040,1176577464816087040,1569352902000,2019-09-25,00:51:42,India Standard Time,24705126,shashitharoor,Shashi Tharoor,,"My StXavier’s Kolkata classmate & close friend Reza Beyad, now a businessman living in London, supports a UK charity helping Kolkata street children. If you’re in London, do attend this event in aid of a good cause! @HopeFoundation @emarbe1954 pic.twitter.com/Va8x7Op0Fi","['hopefoundation', 'emarbe1954']",[],['https://pbs.twimg.com/media/EFQK9yAX4AIofBB.jpg'],22,36,291,[],[],https://twitter.com/ShashiTharoor/status/1176577464816087040,False,,0,,,,,,,"[{'user_id': '24705126', 'username': 'ShashiTharoor'}, {'user_id': '23887490', 'username': 'HopeFoundation'}, {'user_id': '2288638091', 'username': 'emarbe1954'}]",
1176529302822764544,1176529302822764544,1569341419000,2019-09-24,21:40:19,India Standard Time,24705126,shashitharoor,Shashi Tharoor,,"After the Twitter kerfuffle about a mislabelled photograph, here's an authenticated pair of pix from our PM's visit to the US in 1949: a large crowd of people gathers at the University of Wisconsin to listen to a speech by Pandit Jawaharlal Nehru in November 1949. pic.twitter.com/ik0VBbXV0G",[],[],"['https://pbs.twimg.com/media/EFPfKWlWkAI87vq.jpg', 'https://pbs.twimg.com/media/EFPfKWuXkAAEF2f.jpg']",4798,2924,15856,[],[],https://twitter.com/ShashiTharoor/status/1176529302822764544,False,,0,,,,,,,"[{'user_id': '24705126', 'username': 'ShashiTharoor'}]",
1176504255789830151,1176504255789830151,1569335447000,2019-09-24,20:00:47,India Standard Time,24705126,shashitharoor,Shashi Tharoor,,"An interview on the economy disguised as an interview on ""howdy Modi!"" @IndiaToday  https://www.facebook.com/23230437118/posts/10158527121412119/?sfnsn=scwspmo&vh=e …",['indiatoday'],['https://www.facebook.com/23230437118/posts/10158527121412119/?sfnsn=scwspmo&vh=e'],[],38,42,250,[],[],https://twitter.com/ShashiTharoor/status/1176504255789830151,False,,0,,,,,,,"[{'user_id': '24705126', 'username': 'ShashiTharoor'}, {'user_id': '19897138', 'username': 'IndiaToday'}]",
1176468325855039488,1176467146123239425,1569326881000,2019-09-24,17:38:01,India Standard Time,24705126,shashitharoor,Shashi Tharoor,,"3/3 To put it bluntly, the excutive, in the name of its Parliamentary majority, cannot use Parliament's own powers&privileges to undermine itself. In short, Parliament cannot be induced by its own majority to commit suicide. Note: UK precedents are often cited by Indian courts.",[],[],[],87,120,771,[],[],https://twitter.com/ShashiTharoor/status/1176468325855039488,False,,0,,,,,,,"[{'user_id': '24705126', 'username': 'ShashiTharoor'}]",
1176467147733839872,1176467146123239425,1569326600000,2019-09-24,17:33:20,India Standard Time,24705126,shashitharoor,Shashi Tharoor,,2/3 the executive cannot simply distort the rules of procedure&conduct of business under the garb of the Parliament's privilege as a sovereign body to do as it wants. The Court's reasoning is that the executive's legislative majority cannot be used to obstruct Parliament's work.,[],[],[],19,100,673,[],[],https://twitter.com/ShashiTharoor/status/1176467147733839872,False,,0,,,,,,,"[{'user_id': '24705126', 'username': 'ShashiTharoor'}]",
1176467146123239425,1176467146123239425,1569326599000,2019-09-24,17:33:19,India Standard Time,24705126,shashitharoor,Shashi Tharoor,,1/3 The significance of today's UK Supreme Court judgement for those of us who live in other parliamentary systems inspired by the British model should not be missed. The judgement makes clear that the leeway for the political executive to subvert convention is limited: contd.,[],[],[],82,232,1350,[],[],https://twitter.com/ShashiTharoor/status/1176467146123239425,False,,0,,,,,,,"[{'user_id': '24705126', 'username': 'ShashiTharoor'}]",
1176235586207637504,1176235586207637504,1569271391000,2019-09-24,02:13:11,India Standard Time,24705126,shashitharoor,Shashi Tharoor,,Hope it was a great birthday @PurnaParmar. Wishing you a wonderful year ahead & many more joyous birthdays! https://twitter.com/INCTharoorian/status/1175863175306039296 …,['purnaparmar'],['https://twitter.com/INCTharoorian/status/1175863175306039296'],[],10,26,139,[],[],https://twitter.com/ShashiTharoor/status/1176235586207637504,False,https://twitter.com/INCTharoorian/status/1175863175306039296,0,,,,,,,"[{'user_id': '24705126', 'username': 'ShashiTharoor'}, {'user_id': '4273486343', 'username': 'PurnaParmar'}]",
1176232470062088192,1176232470062088192,1569270648000,2019-09-24,02:00:48,India Standard Time,24705126,shashitharoor,Shashi Tharoor,,"I am told this picture (forwarded to me) probably is from a visit to the USSR and not the US. Even if so, it still doesn't alter the message: the fact is that former PMs also enjoyed popularity abroad. When @narendramodi is honoured, @PMOIndia is honoured; respect is for India. https://twitter.com/ShashiTharoor/status/1176181403320385536 …","['narendramodi', 'pmoindia']",['https://twitter.com/ShashiTharoor/status/1176181403320385536'],[],4011,2111,15882,[],[],https://twitter.com/ShashiTharoor/status/1176232470062088192,False,https://twitter.com/ShashiTharoor/status/1176181403320385536,0,,,,,,,"[{'user_id': '24705126', 'username': 'ShashiTharoor'}, {'user_id': '18839785', 'username': 'narendramodi'}, {'user_id': '471741741', 'username': 'PMOIndia'}]",
1176206310125105153,1176206310125105153,1569264411000,2019-09-24,00:16:51,India Standard Time,24705126,shashitharoor,Shashi Tharoor,,I signed this petition calling for the release of @PChidambaram_IN & encourage all to do so: https://www.change.org/p/citizens-of-india-to-protect-the-fundamental-right-of-liberty-of-former-finance-minister-mr-p-chidambaram …,['pchidambaram_in'],['https://www.change.org/p/citizens-of-india-to-protect-the-fundamental-right-of-liberty-of-former-finance-minister-mr-p-chidambaram'],[],2732,976,4639,[],[],https://twitter.com/ShashiTharoor/status/1176206310125105153,False,,0,,,,,,,"[{'user_id': '24705126', 'username': 'ShashiTharoor'}, {'user_id': '3097503906', 'username': 'PChidambaram_IN'}]",
1176201042792304640,1176201042792304640,1569263156000,2019-09-23,23:55:56,India Standard Time,24705126,shashitharoor,Shashi Tharoor,,Fascinating thread about @realDonaldTrump meeting with @ImranKhanPTI at the @UN today. https://twitter.com/tanvi_madan/status/1176186977307242497 …,"['realdonaldtrump', 'imrankhanpti', 'un']",['https://twitter.com/tanvi_madan/status/1176186977307242497'],[],52,117,719,[],[],https://twitter.com/ShashiTharoor/status/1176201042792304640,False,https://twitter.com/tanvi_madan/status/1176186977307242497,0,,,,,,,"[{'user_id': '24705126', 'username': 'ShashiTharoor'}, {'user_id': '25073877', 'username': 'realDonaldTrump'}, {'user_id': '122453931', 'username': 'ImranKhanPTI'}, {'user_id': '14159148', 'username': 'UN'}]",
1176181403320385536,1176181403320385536,1569258473000,2019-09-23,22:37:53,India Standard Time,24705126,shashitharoor,Shashi Tharoor,,"Nehru & India Gandhi in the US in 1954. Look at the hugely enthusiastic spontaneous turnout of the American public, without any special PR campaign, NRI crowd management or hyped-up media publicity. pic.twitter.com/aLovXvCyRz",[],[],['https://pbs.twimg.com/media/EFKivziVUAAOgsS.jpg'],11295,5679,28951,[],[],https://twitter.com/ShashiTharoor/status/1176181403320385536,False,,0,,,,,,,"[{'user_id': '24705126', 'username': 'ShashiTharoor'}]",
1176059630838927362,1172006147055706112,1569229440000,2019-09-23,14:34:00,India Standard Time,24705126,shashitharoor,Shashi Tharoor,,"More sad news for Kashmiri entrepreneurs in this despatch:  https://www.indiaspend.com/we-will-not-survive-this-disaster-kashmiri-entrepreneurs-as-lockdown-continues/ …
We cannot go on like this, depriving our fellow Indian citizens in Kashmir of the right to lead normal lives the rest of us take for granted.
#EndTheLockdownNow!",[],['https://www.indiaspend.com/we-will-not-survive-this-disaster-kashmiri-entrepreneurs-as-lockdown-continues/'],[],82,156,556,['#endthelockdownnow'],[],https://twitter.com/ShashiTharoor/status/1176059630838927362,False,,0,,,,,,,"[{'user_id': '24705126', 'username': 'ShashiTharoor'}]",
1176046312115990534,1176045482092576768,1569226265000,2019-09-23,13:41:05,India Standard Time,24705126,shashitharoor,Shashi Tharoor,,"Addressed the audience before & after to express my appreciation of what had been creatively conceived and effectively staged & choreographed. Well done to the remarkable cast:
@KohmalKhanna
@durkhaima
@Prerna86516784
@DirectPrashant
@TusharKawale29 pic.twitter.com/AjZD8EG1Sz","['kohmalkhanna', 'durkhaima', 'prerna86516784', 'directprashant', 'tusharkawale29']",[],['https://pbs.twimg.com/media/EFIn4ROU8AEkd8e.jpg'],7,16,175,[],[],https://twitter.com/ShashiTharoor/status/1176046312115990534,False,,0,,,,,,,"[{'user_id': '24705126', 'username': 'ShashiTharoor'}, {'user_id': '1277762419', 'username': 'KohmalKhanna'}, {'user_id': '22821635', 'username': 'durkhaima'}, {'user_id': '1732014404', 'username': 'Prerna86516784'}, {'user_id': '2570148920', 'username': 'DirectPrashant'}, {'user_id': '723563082908213248', 'username': 'TusharKawale29'}]",
1176045482092576768,1176045482092576768,1569226067000,2019-09-23,13:37:47,India Standard Time,24705126,shashitharoor,Shashi Tharoor,,"Saw an astonishing play in Kolkata that brilliantly reinvents Chitrangada from the Mahabharata, Chitra from Tagore & contemporary feminism in IsheetaGanguly’s inimitable style. Theatre is alive & well in today’s India! Thanks ⁦@3threewomen⁩ ⁦@YPO⁩ Kolkata pic.twitter.com/MoleiwiGUI","['3threewomen', 'ypo']",[],"['https://pbs.twimg.com/media/EFInCpyUUAAHfAS.jpg', 'https://pbs.twimg.com/media/EFInETpUwAI-50J.jpg', 'https://pbs.twimg.com/media/EFInFm0VUAEuID_.jpg', 'https://pbs.twimg.com/media/EFInG3fUYAAxelY.jpg']",9,43,449,[],[],https://twitter.com/ShashiTharoor/status/1176045482092576768,False,,0,,,,,,,"[{'user_id': '24705126', 'username': 'ShashiTharoor'}, {'user_id': '2522387845', 'username': '3threewomen'}, {'user_id': '106852355', 'username': 'YPO'}]",
1175990059062841345,1175990059062841345,1569212853000,2019-09-23,09:57:33,India Standard Time,24705126,shashitharoor,Shashi Tharoor,,Got to Kolkata from Pune yesterday on direct ⁦@flyspicejet⁩ flight& was impressed w/ the helpfulness of young Shehvar &  Sarika on arrival. Good to see airlines adding flights to make up for the recent turbulence in the sector. pic.twitter.com/NWHyrEbyOY,['flyspicejet'],[],['https://pbs.twimg.com/media/EFH0ttoUwAA2abU.jpg'],710,216,3973,[],[],https://twitter.com/ShashiTharoor/status/1175990059062841345,False,,0,,,,,,,"[{'user_id': '24705126', 'username': 'ShashiTharoor'}, {'user_id': '39214789', 'username': 'flyspicejet'}]",
1175711561282813953,1175711561282813953,1569146454000,2019-09-22,15:30:54,India Standard Time,24705126,shashitharoor,Shashi Tharoor,,"At the end of my interactive session, joined members of @aipcmaha & @aipcPuneNorth with @JhaSanjay in this celebratory pic! pic.twitter.com/lU7KivqX1O","['aipcmaha', 'aipcpunenorth', 'jhasanjay']",[],['https://pbs.twimg.com/media/EFD3bO9UwAAD9JB.jpg'],24,68,550,[],[],https://twitter.com/ShashiTharoor/status/1175711561282813953,False,,0,,,,,,,"[{'user_id': '24705126', 'username': 'ShashiTharoor'}, {'user_id': '932488201708752896', 'username': 'AIPCMaha'}, {'user_id': '927804682617085952', 'username': 'AIPCPuneNorth'}, {'user_id': '50943008', 'username': 'JhaSanjay'}]",
1175673252204564480,1175673252204564480,1569137320000,2019-09-22,12:58:40,India Standard Time,24705126,shashitharoor,Shashi Tharoor,,"Delighted to spend Sunday morning at historic CongressBhavan in Pune addressing @incIndia & @ProfCong members on InclusiveIndia &need to support us in the coming state elections. Wonderful audience& terrific enthusiasm, passion & commitment on display: don’t write us off2quickly! pic.twitter.com/B5qiwBjLti","['incindia', 'profcong']",[],"['https://pbs.twimg.com/media/EFDUag-U8Aov0av.jpg', 'https://pbs.twimg.com/media/EFDUeCKUEAA6G4F.jpg', 'https://pbs.twimg.com/media/EFDUg3DUUAA_erp.jpg', 'https://pbs.twimg.com/media/EFDUjK5U8AEMvNI.jpg']",34,126,698,[],[],https://twitter.com/ShashiTharoor/status/1175673252204564480,False,,0,,,,,,,"[{'user_id': '24705126', 'username': 'ShashiTharoor'}, {'user_id': '1153045459', 'username': 'INCIndia'}, {'user_id': '888260883205324800', 'username': 'ProfCong'}]",
1175671947381731328,1175671947381731328,1569137009000,2019-09-22,12:53:29,India Standard Time,24705126,shashitharoor,Shashi Tharoor,,"My events at the #PuneInternationalLitFest were terrific- huge& keenly engaged audiences, sitting on the aisles& crammed into every corner, asking great questions,listening in rapt attention& applauding generously. Thanks #PILFJadoo! Launched RagaDaSilva’s memoir #UntoldLies. pic.twitter.com/QThKfPKZR1",[],[],"['https://pbs.twimg.com/media/EFDS7CZU0AIBJgi.jpg', 'https://pbs.twimg.com/media/EFDTXdTU4AAc8be.jpg', 'https://pbs.twimg.com/media/EFDTYZ3UcAEveGa.jpg', 'https://pbs.twimg.com/media/EFDTY7kUEAAi9C3.jpg']",10,43,274,"['#puneinternationallitfest', '#pilfjadoo', '#untoldlies']",[],https://twitter.com/ShashiTharoor/status/1175671947381731328,False,,0,,,,,,,"[{'user_id': '24705126', 'username': 'ShashiTharoor'}]",
1175664158479536129,1175664158479536129,1569135152000,2019-09-22,12:22:32,India Standard Time,24705126,shashitharoor,Shashi Tharoor,,The @YPO Punekars had created interesting displays of some of my quotes. Putting my thoughts & ideas into the national discourse about issues that matter is one contribution I’m happy to be able to make. pic.twitter.com/maKyzW5EWS,['ypo'],[],"['https://pbs.twimg.com/media/EFDMQ-jU4AA5TJj.jpg', 'https://pbs.twimg.com/media/EFDMTKlUcAEE_Ao.jpg']",14,38,384,[],[],https://twitter.com/ShashiTharoor/status/1175664158479536129,False,,0,,,,,,,"[{'user_id': '24705126', 'username': 'ShashiTharoor'}, {'user_id': '106852355', 'username': 'YPO'}]",
1175662933067489280,1175662933067489280,1569134860000,2019-09-22,12:17:40,India Standard Time,24705126,shashitharoor,Shashi Tharoor,,"Enjoyed a vibrant interactive session with the Pune Chapter of ⁦@YPO⁩ yesterday, ably moderated by ⁦@AabhaBakaya⁩. Issues raised by the audience ranged from why I joined  ⁦@INCIndia to the ruling party’s communal politics to #InclusiveIndia & Hinduism. pic.twitter.com/20EmeP8n5Y","['ypo', 'aabhabakaya', 'incindia']",[],"['https://pbs.twimg.com/media/EFDLMRTU4AAclxz.jpg', 'https://pbs.twimg.com/media/EFDLMvzU8AAECIY.jpg']",23,26,245,['#inclusiveindia'],[],https://twitter.com/ShashiTharoor/status/1175662933067489280,False,,0,,,,,,,"[{'user_id': '24705126', 'username': 'ShashiTharoor'}, {'user_id': '106852355', 'username': 'YPO'}, {'user_id': '602865727', 'username': 'AabhaBakaya'}, {'user_id': '1153045459', 'username': 'INCIndia'}]",
1175661351349280769,1175661351349280769,1569134483000,2019-09-22,12:11:23,India Standard Time,24705126,shashitharoor,Shashi Tharoor,,"आनंद का संदूक हैं खुशियों की पेटियां
वो बाप खुशनसीब हैं जिनकी हैं बेटियां. 
#DaughtersDay (मेरे सिर्फ़ दो बेटे हैं!) pic.twitter.com/WEzlnUYRuw",[],[],['https://pbs.twimg.com/media/EFDJwjmVUAAmp4m.jpg'],101,232,2272,['#daughtersday'],[],https://twitter.com/ShashiTharoor/status/1175661351349280769,False,,0,,,,,,,"[{'user_id': '24705126', 'username': 'ShashiTharoor'}]",
1175651973275643911,1175651973275643911,1569132247000,2019-09-22,11:34:07,India Standard Time,24705126,shashitharoor,Shashi Tharoor,,My debate with @swapan55 on “NewIndia” at the @IndiaToday Conclave in Mumbai on 20th September: https://youtu.be/kkWrpN4swvs ,"['swapan55', 'indiatoday']",['https://youtu.be/kkWrpN4swvs'],[],34,47,368,[],[],https://twitter.com/ShashiTharoor/status/1175651973275643911,False,,0,,,,,,,"[{'user_id': '24705126', 'username': 'ShashiTharoor'}, {'user_id': '21551205', 'username': 'swapan55'}, {'user_id': '19897138', 'username': 'IndiaToday'}]",
1175371359393726465,1175371359393726465,1569065344000,2019-09-21,16:59:04,India Standard Time,24705126,shashitharoor,Shashi Tharoor,,This young lady is at ⁦@TeachForIndia⁩ & brought three of her students to the Pune International Literary Festival so they inspired to read more — & write too! I was happy to offer them lots of encouragement pic.twitter.com/cK9Z0iFKgt,['teachforindia'],[],['https://pbs.twimg.com/media/EE_CAK_VUAAdQxl.jpg'],34,90,955,[],[],https://twitter.com/ShashiTharoor/status/1175371359393726465,False,,0,,,,,,,"[{'user_id': '24705126', 'username': 'ShashiTharoor'}, {'user_id': '48693594', 'username': 'TeachForIndia'}]",
1175370279997988865,1175370279997988865,1569065086000,2019-09-21,16:54:46,India Standard Time,24705126,shashitharoor,Shashi Tharoor,,Thank you @SaveetaSawant for the lovely gift of a bespectacled Ganesh ji writing a magnum opus! What a perfect tribute to receive at the Pune International Literary Festival! @JayasreeVijayan pic.twitter.com/hlxEA8DyZ0,"['saveetasawant', 'jayasreevijayan']",[],"['https://pbs.twimg.com/media/EE_A7zHUcAE8wee.jpg', 'https://pbs.twimg.com/media/EE_A9O9UEAAXclA.jpg']",26,56,545,[],[],https://twitter.com/ShashiTharoor/status/1175370279997988865,False,,0,,,,,,,"[{'user_id': '24705126', 'username': 'ShashiTharoor'}, {'user_id': '2614828670', 'username': 'SaveetaSawant'}, {'user_id': '1078999172', 'username': 'JayasreeVijayan'}]",
